{
  "schemaVersion": "atlas-agent-envelope/v1",
  "envelopeAlias": "agent-envelope-000001",
  "surveyAlias": "survey-000001",
  "taskKind": "blind-review",
  "populationItemAlias": "population-item-000001",
  "fingerprintAliases": ["fingerprint-000001"],
  "observationReferences": ["observation-00000001"],
  "typedLocatorPatterns": [
    {
      "locatorAlias": "locator-pattern-000001",
      "segments": [
        {
          "kind": "document-role",
          "role": "slot-save"
        },
        {
          "kind": "key-alias",
          "keyAlias": "schema-key-000001"
        },
        {
          "kind": "array-index",
          "index": 0
        }
      ]
    }
  ],
  "structuralShapes": [
    {
      "shapeAlias": "structural-shape-000001",
      "nodeKind": "array",
      "childCountBucket": "one",
      "traits": ["constant-across-corpus"]
    }
  ],
  "sourceFacts": [],
  "evidenceTags": ["observed-structure"],
  "prohibitedContentAttestation": true
}
